No,Title,Url,Est. Visits,Backlinks,Facebook shares,Pinterest Shares,Reddit Shares
1,Learn Lebanese Arabic with the Unique Long-Term ...,http://www.17-minute-languages.com/en/learn-lebanese-arabic/,2,21,3,0,0
2,You should learn Lebanese Arabic to know what the ...,http://www.instagram.com/reel/DQeDC0WEppi/,1,0,0,0,0
3,Learn To Write Arabic Alphabets: Learn Lebanese Arabic ...,http://www.amazon.com/Learn-Write-Arabic-Alphabets-Beginners/dp/B0BJ4LL78M,1,0,0,0,0
4,How to learn Lebanese Arabic,http://www.quora.com/How-can-I-learn-Lebanese-Arabic,0,0,1,0,0
5,"Learn Lebanese Arabic: Letters, Vowels and Script",http://www.facebook.com/freeonlinecourseswithcertificates/posts/learn-lebanese-arabic-letters-vowels-and-script-teachingandacademics-languagelea/1559672862831523/,0,0,0,0,0
6,Teach and Learn Lebanese Arabic For Kids and Beginners,http://www.amazon.com.au/Lebanese-Arabic-Beginners-Bilingual-Translations/dp/B0DX5PWB9L,0,0,0,0,0
7,"Learn Lebanese Arabic quickly, naturally and effortlessly with ...",http://www.learnlanguages24.com/learn-lebanese-arabic-travel-course/,0,0,0,0,0
8,"Learn Lebanese Arabic (Seen, sheen)",http://polyglotclub.com/language/standard-arabic/video/10490/translate-russian,0,0,0,0,0
9,Best Way to Learn Lebanese Arabic,http://thetalklist.com/best-way-to-learn-lebanese-arabic/,0,2,0,0,0
10,Good websites to learn Lebanese Arabic for an English ...,http://www.reddit.com/r/lebanon/comments/edhh2w/good_websites_to_learn_lebanese_arabic_for_an/,0,0,0,0,0
11,‏Learn Lebanese Arabic! 🔥🇱🇧 ⚠️ Other variations exist ...,http://www.tiktok.com/@thelebanesecouple1/video/7621209959207947541,0,0,0,0,0
12,Learn Lebanese Arabic dialect for free,http://www.youtube.com/playlist?list=PL6z72IKA57oXdXOnX14w0abwj-IP5eMPI,0,0,0,0,0
13,The Easy Way to Learn Lebanese Arabic: The Ultimate Guide ...,http://knihy.heureka.sk/lebanese-101-the-easy-way-to-learn-lebanese-arabic-the-ultimate-guide-to-become-a-lebanese_2/,0,0,0,0,0
14,How to Learn Lebanese Arabic - The Classroom,http://www.theclassroom.com/learn-lebanese-arabic-5328842.html,0,2,0,0,0
15,How to Learn Lebanese Arabic in Only 15 Lessons eBook,http://www.amazon.co.uk/Learn-Lebanese-Arabic-Only-Lessons-ebook/dp/B0CBLZLJ3G,0,0,0,0,0
16,The Easy Way to Learn Lebanese Arabic: The Ultimate ...,http://www.amazon.ca/Lebanese-101-Arabic-Ultimate-Become/dp/1690824581,0,0,0,0,0
17,"Learn Lebanese Arabic: Letters, Vowels and Script",http://www.udemy.com/course/learn-lebanese-arabic-letters-vowels-and-script/,0,1,0,0,0
18,Learn Lebanese Arabic in an Easy way,http://medium.com/@learnwithibra/learn-lebanese-with-ibra-d6ab36ac2a70,0,0,0,0,0
19,Learn Lebanese Arabic with Keefak - Armigatus,http://armigatus.wordpress.com/2012/05/31/learn-lebanese-arabic-with-keefak/,0,0,0,0,0
20,How to learn Lebanese Arabic? | studio arabiya,http://studioarabiyaeg.com/how-to-learn-lebanese-arabic/,0,0,0,0,0
21,"The Easy Way to Learn Lebanese Arabic, Band 1",http://www.amazon.de/Lebanese-101-Arabic-Ultimate-Become/dp/1690824581,0,0,0,0,0
22,Learn Lebanese Arabic Online Free: Your Ultimate Guide ...,http://talkpal.ai/learn-lebanese-arabic-online-free-your-ultimate-guide-to-fluent-dialect-mastery/,0,0,0,0,0
23,The Best Way to Learn Lebanese Arabic,http://worldschoolbooks.com/the-best-way-to-learn-lebanese-arabic/,0,0,0,0,0
