"TITLE","AUTHOR","ASIN/ISBN","TYPE"
"levant","","","-"
"levant cookbook","","","Amazon Suggestions"
"levant cookery","","","Amazon Suggestions"
"levant philip mansel","","","Amazon Suggestions"
"levant trilogy","","","Amazon Suggestions"
"levant trilogy olivia manning","","","Amazon Suggestions"
"levantine arabic","","","Amazon Suggestions"
"levantine arabic grammar","","","Amazon Suggestions"
"levant robot vacuum","","","Amazon A to Z Suggestions"
"levant splendour and catastrophe on the mediterranean","","","Amazon A to Z Suggestions"
"levant","philip mansel","0719567084","Search Results"
"levant","rawia bishara","0857834177","Search Results"
"neolithic revolution","e.j. peltenburg","1842171321","Search Results"
"seductive flavours of the levant","nada saleh","1861054467","Search Results"
"les échelles du levant","amin maalouf","224649771X","Search Results"
"levant","john corin","0904040372","Search Results"
"euphrates river valley settlement","e.j. peltenburg","1842172727","Search Results"
"time in the levant","anthony wood","1789015413","Search Results"
"the levant trilogy","olivia manning","0753808188","Search Results"
"byblos in the late bronze age","marwan kilani","9004416595","Search Results"
"pirates of the levant","arturo perez reverte","0452297303","Search Results"
"a journey into the levant as it once was","john   renata fox","1912655233","Search Results"
"landscapes in transition","bill finlayson","1842174169","Search Results"
"china virus","ezra levant","1777198615","Search Results"
"a voyage into the levant","joseph pitton de tournefort","1108075223","Search Results"
"baal  st. george, and khidr","robert d. miller","157506989X","Search Results"
"crusader landscapes in the medieval levant","balazs major","1783169249","Search Results"
"the land before the kingdom of israel","brendon c benz","1575064278","Search Results"
"lives between the lines","michael vatikiotis","1474613195","Search Results"
"embassy to tamerlane  1403 1406 ","ruy gonzalez de clavijo","1843821982","Search Results"
"the syrian refugee crisis in lebanon","robert g. rabil","1498535143","Search Results"
"rise of the hyksos","anna latifa mourad","178491133X","Search Results"
"japon gourmand. voyage culinaire au pays du soleil levant","laure kié","2317020848","Search Results"
"a visit to the monasteries in the levant ","robert curzon","1397745657","Search Results"
"the british in the levant","christine laidlaw","0755600614","Search Results"
"beirut","alexander mcnabb","1477586598","Search Results"
"the levant express","micheline r. ishay","B07VLP35TH","Search Results"
"l'ère du levant","anne fremaux","B0915MBMTJ","Search Results"
"the barber of damascus","dana sajdi","0804797277","Search Results"
"popular muslim reactions to the franks in the levant  1097–1291","alex mallett","0367601036","Search Results"
"the levant trilogy","olivia manning","0141186453","Search Results"
"seagoing ships and seamanship in the bronze age levant ","shelley wachsmann","1603440801","Search Results"
"war in the islands","adrian seligman","0750911808","Search Results"
"the flora graeca story","h.w. lack","0198548974","Search Results"
"the levant ","pierre louis gatier","3829004958","Search Results"
"the kingdom of kush","captivating history","1647489024","Search Results"
"the latins in the levant","william miller","B008GNWD2Q","Search Results"
"the social archaeology of the levant","assaf yasur landau","1107156688","Search Results"
"travels in the levant","pierre belon","1843821966","Search Results"
"trading with the ottomans","despina vlami","1780768893","Search Results"
"the levant","william harris","1558763686","World History"
"migration and colonialism in late second millennium bce levant and","pekka pitkänen","1138677035","World History"
"the republic of letters and the levant ","alastair hamilton","9004147616","World History"
"the papacy and the levant","kenneth m. setton","0871691620","World History"
"the levant","william harris","1558766030","World History"
"the papacy and the levant ","kenneth m setton","0871691612","World History"
"la france au levant","pierre dufour","285704688X","World History"
"towns in ancient israel and in the southern levant","c.h.j degeus","9042912693","World History"
"a voyage into the levant","joseph pitton de tournefort","1108075231","History of Middle East Asia"
"bright levant ","sir laurence grafftey smith","1900988429","History of Asia"
"struggle in the levant","caroline attie","1860644678","History of Asia"
"franks  muslims and oriental christians in the latin levant","benjamin z. kedar","0754659127","History of Asia"
"lithics after the stone age","steven a. rosen","0761991247","History of Asia"
"the levant in transition","peter j. parr","1904350992","History of Asia"
"japoneries d'automne","pierre loti","B079ZS6W5S","History of Asia"
"scholarship between europe and the levant","jan loop","900442931X","History of Asia"
"chasing smoke","sarit packer","1911641328","Barbecues"
"zaitoun","yasmin khan","1408883848","Food & Travel Writing"
"a new book of middle eastern food","claudia roden","014046588X","Food & Travel Writing"
"gunpowder","devina seth","B07CBYK41R","Food & Travel Writing"