"TITLE","AUTHOR","ASIN/ISBN","TYPE"
"arab","","","-"
"arab spring","","","Amazon Suggestions"
"arabesque table","","","Amazon Suggestions"
"arabian nights","","","Amazon Suggestions"
"arabian nights book","","","Amazon Suggestions"
"arabic","","","Amazon Suggestions"
"arabic books","","","Amazon Suggestions"
"arabic books for kids","","","Amazon Suggestions"
"arabic dictionary","","","Amazon Suggestions"
"arabic grammar","","","Amazon Suggestions"
"arabic poetry","","","Amazon Suggestions"
"arab and islamic silver","","","Amazon A to Z Suggestions"
"arab book","","","Amazon A to Z Suggestions"
"arab coloring book","","","Amazon A to Z Suggestions"
"arab conquests","","","Amazon A to Z Suggestions"
"arab cookbook","","","Amazon A to Z Suggestions"
"arab culture","","","Amazon A to Z Suggestions"
"arab dress","","","Amazon A to Z Suggestions"
"arab explorers","","","Amazon A to Z Suggestions"
"arab food","","","Amazon A to Z Suggestions"
"arab gift set","","","Amazon A to Z Suggestions"
"arab history","","","Amazon A to Z Suggestions"
"arab horse","","","Amazon A to Z Suggestions"
"arab israeli conflict","","","Amazon A to Z Suggestions"
"arab israeli wars","","","Amazon A to Z Suggestions"
"arab jewellery","","","Amazon A to Z Suggestions"
"arab kafiya keffiyeh middle eastern scarf wrap","","","Amazon A to Z Suggestions"
"arab legion","","","Amazon A to Z Suggestions"
"arab mig 19","","","Amazon A to Z Suggestions"
"arab migs","","","Amazon A to Z Suggestions"
"arab name necklace","","","Amazon A to Z Suggestions"
"arab of the future","","","Amazon A to Z Suggestions"
"arab of the future 5","","","Amazon A to Z Suggestions"
"arab poetry","","","Amazon A to Z Suggestions"
"arab room spray","","","Amazon A to Z Suggestions"
"arab slave trade","","","Amazon A to Z Suggestions"
"arab tribes","","","Amazon A to Z Suggestions"
"arab uniform","","","Amazon A to Z Suggestions"
"arab vase","","","Amazon A to Z Suggestions"
"arab women","","","Amazon A to Z Suggestions"
"arabs","tim mackintosh–smith","0300180284","Search Results"
"the arabs","eugene rogan","B0083DJVP6","Search Results"
"the arab revolt 1916 18","david murphy","184603339X","Search Results"
"the arabs","eugene rogan","0141986549","Search Results"
"the crusades through arab eyes ","amin maalouf","0863560237","Search Results"
"the united arab emirates","kristian coates ulrichsen","1138813656","Search Results"
"trust me  i’m an arab","omar bdour","1838291105","Search Results"
"when we were arabs","massoud hayoun","1620974169","Search Results"
"the marsh arabs ","wilfred thesiger","0141442085","Search Results"
"the arab uprisings","jeremy bowen","0857208861","Search Results"
"birds of the united arab emirates ","simon aspinall","1472982576","Search Results"
"the arab of the future 4","riad sattouf","1250150663","Search Results"
"the arab lands under ottoman rule","jane hathaway","1138643459","Search Results"
"the arab winter","noah feldman","0691194920","Search Results"
"the arab of the future","riad sattouf","1473638119","Search Results"
"a history of the arab peoples","albert hourani","0571288014","Search Results"
"arab spring then and now","robert fisk","1633534936","Search Results"
"the arab of the future 3","riad sattouf","1473638283","Search Results"
"the arab of the future 2","riad sattouf","1473638232","Search Results"
"desiring arabs","joseph a. massad","0226509591","Search Results"
"arabicity","rose issa","086356688X","Search Results"
"a bibliography for after jews and arabs","ammiel alcalay","1953035345","Search Results"
"how the west stole democracy from the arabs","elizabeth f. thompson","1611856396","Search Results"
"the arab and jewish questions","bashir","023119921X","Search Results"
"a tourist in the arab spring ","tom chesshyre","1841624756","Search Results"
"arab archery","nabih amin faris","8834141229","Search Results"
"the iron wall","avi shlaim","0141033223","Search Results"
"a history of arab graphic design","bahia shehab","9774168917","Search Results"
"the arabesque table","reem kassis","1838662510","Search Results"
"gordian iii and philip the arab","ilkka syvänne","1526786753","Search Results"
"the arabian nights cookbook","habeeb salloum","0804846456","Search Results"
"when all the lands were sea","tor eigeland","1566569826","Search Results"
"1948","benny morris","0300151128","Search Results"
"firm financing and growth in the arab region","world bank world bank group publications","B08Z9LSS3T","Search Results"
"contemporary arab thought","elizabeth suzanne kassab","023114489X","Search Results"
"the new middle east","paul danahar","1408870177","Search Results"
"classical poems by arab women","abdullah al udhari","0863560474","Search Results"
"arab israeli air wars 1947-82","shlomo aloni","1841762946","Search Results"
"air power and the arab world 1909 1955","david nicolle","1913118762","Search Results"
"in god's path","robert g. hoyland","0190618574","Search Results"
"making the arab world","fawaz a. gerges","0691167885","Search Results"
"excellent daughters","katherine zoepf","0143109944","Search Results"
"revolution without revolutionaries","asef bayat","1503602583","Search Results"
"the legacy of arab islam in africa","john allembillah azumah","1851682732","Search Results"
"when in the arab world","rana nejem","191289209X","Search Results"
"human rights and the arab spring","bachar el halabi (author)","1680531670","Search Results"
"the arab conquests","justin marozzi","1838933409","Search Results"
"a world i loved","wadad makdisi cortas","1568584296","Search Results"
"storm in the desert","mark muller stuart","1780274521","Search Results"
"poems from arab andalusia","cola franzen","0872862429","Search Results"
"a history of the arab israeli conflict","ian j. bickerton","0205753388","History of Slavery"
"a concise history of the arab israeli conflict","ian j. bickerton","0137551002","History of Slavery"
"the arab israeli conflict ","ross stewart","0431170622","History of Slavery"
"the arab israeli conflict ","s.j. perkins","0333409191","History of Slavery"
"jews in arab countries","georges bensoussan","025303857X","History of Slavery"
"jews and the arab world","ron duncan hart","1935604384","History of Slavery"
"the arab israeli conflict ","tony mcaleavy","0521629535","History of Slavery"
"the arab israeli conflict ","noah berlatsky","0737756454","History of Slavery"
"palestine and the arab israeli conflict","charles d. smith","1319028055","History of Middle East Asia"
"understanding arabs","margaret k. nydell","0983955808","History of Northern Africa"
"the world through arab eyes","shibley telhami","0465029833","History of Northern Africa"
"voices of the arab spring","asaad alsaleh","0231163193","History of Northern Africa"
"the battle for the arab spring","lin noueihed","0300194153","History of Northern Africa"
"the arab spring","jason brownlee","0199660077","History of Northern Africa"
"the arab spring","hamid dabashi","1780322232","History of Northern Africa"
"the arab spring","mark l. haas","0813349745","History of Northern Africa"
"the arabs","eugene rogan","046509421X","History of Northern Africa"
"arab modernism as world cinema","limbrick","0520330579","History of Northern Africa"
"winners and losers in the ‘arab spring’","yossi (joseph) alpher","0367227533","Religious History of Islam"
"the arab mind","raphael patai","0967201551","Religious History of Islam"
"arabia and the arabs","robert g. hoyland","0415195357","Religious History of Islam"
"before homosexuality in the arab islamic world  1500-1800","khaled el–rouayheb","0226729885","Religious History of Islam"
"keepers of the golden shore","michael quentin morton","1780235801","Religious History of Islam"
"protestants  gender and the arab renaissance in late ottoman syria ","womack","1474436722","Religious History of Islam"
"understanding the arab israeli conflict","michael rydelnik","0802426239","Religious Studies History"
"the orthodox church in the arab world  7001700","samuel noble","0875807011","Religious Studies History"
"imagining the arabs","peter webb","1474426433","Religious Studies History"
"caravanserai","hanifa deen","1863738657","Religious Studies History"
"the arab christian","kenneth cragg","0664221823","Religious Studies History"
"arabs and empires before islam","greg fisher","0198810148","Religious Studies History"
"arab news and conflict","samia bazzi","9027206252","Sociolinguistics"
"why are the arabs not free ","moustapha safouan","140516171X","Sociolinguistics"
"the impact of global english on cultural identities in the","sarah hopkyns","0367230038","Sociolinguistics"
"assessing efl writing in the 21st century arab world","abdelhamid ahmed","B077G79DW2","Sociolinguistics"
"language variation and change in a modernising arab state","holes","0710302444","Sociolinguistics"
"comics in contemporary arab culture ","jacob hoigilt","1784539856","Sociolinguistics"
"language and change in the arab middle east"," ","B01FIZMYOG","Sociolinguistics"
"efl pedagogy as cultural discourse","muzna awayed bishara","1138308811","Sociolinguistics"
"arabic  self and identity","yasir suleiman","0199747016","Sociolinguistics"