No,Keyword,Search Intent,Search Volume,CPC,Paid Difficulty,SEO Difficulty
1,"lebanese arabic","informational, commercial","1,300","US$14.45","4","57"
2,"learn lebanese arabic","commercial, transactional","320","US$5.83","66","35"
3,"lebanese language","informational","3,600","US$4.25","1","36"
4,"where lebanese","informational","14,800","US$0.00","1","52"
5,"what language lebanon speak","informational","2,400","US$0.00","1","42"
6,"what language do lebanese speak","informational","1,000","US$0.00","1","31"
7,"when lebanon was founded","informational","480","US$0.00","1","46"
8,"what language does lebanon speak","informational","480","US$0.00","1","39"
9,"are lebanese arab","informational","320","US$0.00","1","39"
10,"what is language of lebanon",null,"320","US$0.00","1","5"
11,"are lebanese arabic","informational","320","US$0.00","1","53"
12,"are lebanese arab or persian","informational","170","US$0.00","1","46"
13,"do lebanese speak arabic","commercial, transactional, informational","170","US$0.00","1","49"
14,"where can i learn arabic","transactional","170","US$5.17","70","76"
15,"which arabic dialect to learn","informational","110","US$2.63","5","21"
16,"language lebanese speak",null,"90","US$0.00","1","14"
17,"how to learn lebanese arabic","commercial, transactional, informational","70","US$6.27","56","26"
18,"how many lebanese in usa","informational","70","US$0.00","1","47"
19,"how to learn lebanese language",null,"50","US$3.84","72","27"
20,"who is lebanese","informational","40","US$0.00","1","51"
21,"how many lebanese in lebanon","informational","30","US$0.00","1","59"
22,"are lebanese arab people",null,"30","US$0.00","1","5"
23,"how to learn arabic on your own","commercial, transactional","30","US$1.19","26","52"
24,"what race are lebanese considered","informational","30","US$0.00","1","42"
25,"are lebanese arab or middle eastern",null,"20","US$0.00","1","5"
26,"which arabic to learn",null,"20","US$0.00","7","8"
27,"where to learn levantine arabic",null,"20","US$2.48","52","21"
28,"is there a lebanese language",null,"20","US$0.00","1","5"
29,"where to learn lebanese arabic",null,"10","US$2.85","77","29"
30,"who speaks levantine arabic",null,"10","US$0.00","1","5"
31,"when lebanon became a country",null,"10","US$0.00","1","5"
32,"how are you lebanese arabic",null,"10","US$0.00","1","5"
33,"how to speak lebanese arabic",null,"10","US$1.39","24","13"
34,"how to learn lebanese arabic online for free",null,"10","US$0.00","1","5"
35,"how many lebanese are in the world",null,"10","US$0.00","1","5"
36,"how much lebanese lira is one dollar",null,"10","US$0.00","1","5"
37,"how much arabic words are there",null,"10","US$0.00","1","5"
38,"how many languages are spoken in lebanon",null,"10","US$0.00","1","5"
39,"why in lebanese arabic",null,"10","US$0.00","1","5"
40,"when arabic language started",null,"10","US$0.00","1","5"
41,"how lebanese are you quiz",null,"10","US$0.00","1","5"
42,"can you learn arabic",null,"10","US$0.00","18","11"
43,"lebanese learn",null,"10","US$0.00","1","18"
44,"is lebanese a language or dialect",null,"10","US$0.00","1","5"
45,"which language does lebanese speak",null,"10","US$0.00","1","5"
46,"which language lebanon speak",null,"10","US$0.00","1","5"
47,"lebanon which language",null,"10","US$0.00","1","13"
48,"what language lebanese people speak",null,"10","US$0.00","1","5"
49,"what is aerie in lebanese language",null,"10","US$0.00","1","5"
50,"how are you in lebanese language",null,"10","US$0.00","1","5"
51,"how many lebanese speak french",null,"10","US$0.00","1","5"
52,"how much language in afghanistan",null,"10","US$0.00","1","5"
53,"how much in lebanese arabic",null,"0","US$0.00","1","4"
54,"is lebanese arabic easy to learn",null,"0","US$0.00","1","4"
55,"is lebanese arabic hard to learn",null,"0","US$0.00","1","4"
56,"can lebanese understand arabic",null,"0","US$0.00","1","4"
57,"is lebanese arabic food",null,"0","US$0.00","1","4"
58,"is lebanese arabic the same as palestinian",null,"0","US$0.00","1","4"
59,"is lebanese arabic on duolingo",null,"0","US$0.00","1","4"
60,"can in lebanese arabic",null,"0","US$0.00","1","4"
61,"can you learn lebanese arabic on duolingo",null,"0","US$0.00","1","4"
62,"can i have in lebanese arabic",null,"0","US$0.00","1","4"
63,"can lebanese understand egyptian",null,"0","US$0.00","1","4"
64,"why levantine arabic",null,"0","US$0.00","1","12"
65,"why does lebanese arabic sound french",null,"0","US$0.00","1","4"
66,"why is lebanese arabic different",null,"0","US$0.00","1","4"
67,"why lebanese are successful",null,"0","US$0.00","1","4"
68,"why lebanese food is the best",null,"0","US$0.00","1","4"
69,"where levantine arabic",null,"0","US$0.00","1","12"
70,"where in lebanese arabic",null,"0","US$0.00","1","4"
71,"where are you lebanese arabic",null,"0","US$0.00","1","4"
72,"who speaks lebanese",null,"0","US$0.00","1","12"
73,"what arabic does lebanon speak",null,"0","US$0.00","1","4"
74,"which in lebanese arabic",null,"0","US$0.00","1","4"
75,"which language lebanese speak",null,"0","US$0.00","1","4"
76,"lebanese which language",null,"0","US$0.00","1","12"
77,"is lebanese arabic easy",null,"0","US$0.00","1","4"
78,"is lebanese arabic hard",null,"0","US$0.00","1","4"
79,"is lebanese arabic similar to palestinian",null,"0","US$0.00","1","4"
80,"when levantine arabic",null,"0","US$0.00","1","12"
81,"when a lebanese woman does a language challenge",null,"0","US$0.00","1","4"
82,"what's levantine arabic",null,"0","US$0.00","1","12"
83,"what's lebanese language",null,"0","US$0.00","1","12"
84,"lebanese what language do they speak",null,"0","US$0.00","1","4"
85,"what time in lebanese arabic",null,"0","US$0.00","1","4"
86,"what are you doing lebanese arabic",null,"0","US$0.00","1","4"
87,"what is beautiful in lebanese arabic",null,"0","US$0.00","1","4"
88,"how is lebanese arabic different",null,"0","US$0.00","1","4"
89,"how in lebanese arabic",null,"0","US$0.00","1","4"
90,"how to learn lebanese arabic reddit",null,"0","US$0.00","1","4"
91,"how to say in lebanese arabic",null,"0","US$0.00","1","4"
92,"how lebanese talk",null,"0","US$0.00","1","12"
93,"how many levantine arabic speakers",null,"0","US$0.00","1","4"
94,"how many in lebanese arabic",null,"0","US$0.00","1","4"
95,"how many lebanese speak arabic",null,"0","US$0.00","1","4"
96,"how many in levantine arabic",null,"0","US$0.00","1","4"
97,"how many lebanese in california",null,"0","US$0.00","1","4"
98,"how much levantine arabic",null,"0","US$0.00","1","4"
99,"how much is lebanese lira",null,"0","US$0.00","1","4"
100,"how long in lebanese arabic",null,"0","US$0.00","1","4"
101,"what's up in lebanese arabic",null,"0","US$0.00","1","4"
102,"what's wrong in lebanese arabic",null,"0","US$0.00","1","4"
103,"can lebanese speak arabic",null,"0","US$0.00","1","4"
104,"does lebanese arabic have french",null,"0","US$0.00","1","4"
105,"is lebanese arabic eastern",null,"0","US$0.00","1","4"
106,"what is grandma in lebanese arabic",null,"0","US$0.00","1","4"
107,"who in lebanese arabic",null,"0","US$0.00","1","4"
108,"how to learn lebanese arabic for free",null,"0","US$0.00","1","4"
109,"is lebanese arabic influenced by french",null,"0","US$0.00","1","4"
110,"do lebanese fast",null,"0","US$0.00","1","12"
111,"where is lebanese on the map",null,"0","US$0.00","1","4"
112,"are lebanon arabic",null,"0","US$0.00","1","12"
113,"how many people speak lebanese arabic",null,"0","US$0.00","1","4"
114,"how much is lebanese currency",null,"0","US$0.00","1","4"
115,"what is orange in lebanese arabic",null,"0","US$0.00","1","4"
116,"can you in lebanese arabic",null,"0","US$0.00","1","4"
117,"who are you in lebanese arabic",null,"0","US$0.00","1","4"
118,"is lebanese arabic close to msa",null,"0","US$0.00","1","4"
119,"is lebanese arabic similar to syrian",null,"0","US$0.00","1","4"
120,"can i get in lebanese arabic",null,"0","US$0.00","1","4"
121,"how many words in lebanese arabic",null,"0","US$0.00","1","4"
122,"how to say how much in lebanese arabic",null,"0","US$0.00","1","4"
123,"why in lebanese",null,"0","US$0.00","1","12"
124,"are lebanese arab or white",null,"0","US$0.00","1","4"
125,"why do lebanese speak arabic",null,"0","US$0.00","1","4"
126,"how much is lebanese pound",null,"0","US$0.00","1","4"
127,"are lebanese arab or asian",null,"0","US$0.00","1","4"
128,"how to learn arabic lebanese dialect",null,"0","US$0.00","1","4"
129,"where can i learn lebanese arabic",null,"0","US$0.00","1","4"
130,"how to learn lebanese arabic fast",null,"0","US$0.00","1","4"
131,"how long to learn lebanese arabic",null,"0","US$0.00","1","4"
132,"book to learn lebanese arabic",null,"0","US$0.00","1","4"
133,"can you learn arabic from the quran","commercial, transactional, informational","0","US$0.00","1","4"
134,"how to learn arabic in a year","informational, transactional, commercial","0","US$0.00","1","4"
135,"how to learn arabic in 3 months",null,"0","US$0.00","1","4"
136,"lebanese language which country",null,"0","US$0.00","1","4"
137,"is lebanese language",null,"0","US$0.00","1","12"
138,"is lebanon language",null,"0","US$0.00","1","12"
139,"where is lebanon language",null,"0","US$0.00","1","4"
140,"what's lebanon language",null,"0","US$0.00","1","12"
141,"what is lebanese language called",null,"0","US$0.00","1","4"
142,"what's lebanon official language",null,"0","US$0.00","1","4"
143,"are lebanese arabic people",null,"0","US$0.00","1","4"
